Mata_duree,Turtii_yeroo,Liinkii
Itoophiyaan qaala'insa gatii to'achuuf imaammata maallaqaa fooyyessuufi,11 Hagayya 2023,https://www.bbc.com//afaanoromoo/articles/cndk63r84dzo
"Aanaa Gooroo Doolaatti hidhaa, reebichi, saamichii fi buqqaatiin hammaachuu jiraattonni himan",Sa'aatii tokko dura,https://www.bbc.com//afaanoromoo/articles/c88vx8n092qo
Guyyaatti tarkaanfii 5000 lafoo deemuun du'a yeroo malee hambisa - Qorannoo,Sa'aatii tokko dura,https://www.bbc.com//afaanoromoo/articles/cy0pm8n5r35o
Arjantinaan deeggartoota kubbaa miilaa qarshii tarsaasan adabuufi,Sa'aatii tokko dura,https://www.bbc.com//afaanoromoo/articles/cw0nvdgdlwko
Raashiyaan dhimma Nijeer irratti gidduseentummaa waraanaa ECOWAS akeekkachiifte,Daqiiqaa 12 dura,https://www.bbc.com//afaanoromoo/articles/cx7yd35j3ewo
UN tarkaanfiin naannoo Amaaraatti fudhatamu kan wal gitu akka ta’u gaafate,11 Hagayya 2023,https://www.bbc.com//afaanoromoo/articles/c04xl38vp49o
'Magaalota Naannoo Amaaraatti nageenyiifi sochiin idilee deebi'eera' - Mootummaa,11 Hagayya 2023,https://www.bbc.com//afaanoromoo/articles/c2qdvrqr5x1o
Biyyoonni jajjaboon shan haalli Oromiyaafi Amaaraa keessaa nu yaaddeesse jedhan,11 Hagayya 2023,https://www.bbc.com//afaanoromoo/articles/cy7yz75dev2o
Magaalonni Naannoo Amaaraa humnoonni mootummaa to'atan maal keessa jiru?,10 Hagayya 2023,https://www.bbc.com//afaanoromoo/articles/crgl9ep8xv9o
Itoophiyaan jaalattoota saala wal fakkaatoo fi dhaabbilee gochichi keessatti raawwate jette irratti tarkaanfii fudhachuu himte,11 Hagayya 2023,https://www.bbc.com//afaanoromoo/articles/clk3eg74072o
Godina Qellam Wallaggaa keessaa ibsaa argataa kan jiran aanaalee lama qofa- Qondaala Humna ibsaa,11 Hagayya 2023,https://www.bbc.com//afaanoromoo/articles/c6pvjn7le23o
Xaa'oo tooniin kumoota dhibbaan alaa galaa jiru qonnaan bulaa qaqqabaa jiraa?,11 Hagayya 2023,https://www.bbc.com//afaanoromoo/articles/c3g8dyp55z5o
Biyyoonni Afrikaa lixaa rakkoo fonqolcha Niijeeriin dhalate humna waraanaan furuuf murteessan,11 Hagayya 2023,https://www.bbc.com//afaanoromoo/articles/c98prrvyxweo
Hospitaala Gondar hanqinni oksijiniifi qorichaa mudachuu himame,9 Hagayya 2023,https://www.bbc.com//afaanoromoo/articles/c281ly80mvdo
Walitti bu'iinsa Naannoo Amaaraatti fufeen lammiileen nagaa lubbuu dhabuu maddeen himan,8 Hagayya 2023,https://www.bbc.com//afaanoromoo/articles/cd1yx2nreg0o
"'Guyyoota sadiif hoteelaa hin baane, nyaatas hin arganne'- Barsiisaa qormaataaf Gondaritti ergaman",8 Hagayya 2023,https://www.bbc.com//afaanoromoo/articles/cjj1xljjepxo
'Tarkaanfii fudhatameen magaalota hedduutti nagaan bu'aa jira' - Naannoo Amaaraa,8 Hagayya 2023,https://www.bbc.com//afaanoromoo/articles/c1rz18dln8jo
Magaalaan Finfinnee fi naannoleen uummata Amaaraa fi Raayyaa Ittisaa cinaa hiriirra jedhan,7 Hagayya 2023,https://www.bbc.com//afaanoromoo/articles/crg7jlj9nvlo
'Naannoo Amaaraa Komaandi poostii afuritti hiruun oppireeshinii jalqabneerra',7 Hagayya 2023,https://www.bbc.com//afaanoromoo/articles/cw5r0gr2e47o
Dhaabbati Fayyaa Addunyaa haalli naannoo Amaaraa isa yaaddessuu hime,7 Hagayya 2023,https://www.bbc.com//afaanoromoo/articles/cede7z2v32yo
Obbo Kiristiyaan Taaddala humnoota nageenyaan to'annoo jala oolan,5 Hagayya 2023,https://www.bbc.com//afaanoromoo/articles/cpezpvgy3l3o
'Labsiin Yeroo Muddamaa mirgoota namoomaa bu'uuraa daangessuu hin qabu' - KMNI,5 Hagayya 2023,https://www.bbc.com//afaanoromoo/articles/cw4g27g7e8eo
'Labsiin Yeroo Muddamaa N. Amaaraatti labsame ji'oota jahaaf tura' - Ministeera Haqaa,4 Hagayya 2023,https://www.bbc.com//afaanoromoo/articles/cnlyw71xx4wo
Yuukireen namoota dullooman gowwoomsuun haleellaa gaggeessiti - Raashiyaa,9 Hagayya 2023,https://www.bbc.com//afaanoromoo/articles/cw4gm2y30kjo
Raashiyaan wiirtuu Yukireen dhiiga raabsu boombiin rukutte - Zeleniskii,6 Hagayya 2023,https://www.bbc.com//afaanoromoo/articles/cgedpepv14po
Buufata Galaanaa Raashiyaatti haleellaan diroonii gaggeeffame,4 Hagayya 2023,https://www.bbc.com//afaanoromoo/articles/c881m24g2j5o
'Waraanichi Raashiyaatti garagalaa jira' - Zeleniskii haleellaa dirooniin booda,31 Adooleessa 2023,https://www.bbc.com//afaanoromoo/articles/c51vv05jzv3o
'Namoonni ekeraa Baahmut nuun jedhu',1 Hagayya 2023,https://www.bbc.com//afaanoromoo/articles/crgnney8qzzo
Biyya ammallee Puutin deeggartoota jabaa keessatti qaban,31 Adooleessa 2023,https://www.bbc.com//afaanoromoo/articles/c6pr5p5v5x4o
'Raashiyaan marii nagaa Yukireen hin diddu' - Puutin,30 Adooleessa 2023,https://www.bbc.com//afaanoromoo/articles/c1rz9vj9gy4o
Kora Raashiyaa - Afrikaa: MM Abiy Ahimad Pirezidant Putiin waliin mari'atan,26 Adooleessa 2023,https://www.bbc.com//afaanoromoo/articles/c2jr74kd9e1o
Putiin biyyi isaanii biyyoota Afrikaaf midhaan tola akka ergitu himan,27 Adooleessa 2023,https://www.bbc.com//afaanoromoo/articles/c1rzl3g274qo
'Putin ammallee dursaa garee Waagnar haaloo bayachuu barbaaduu malu' - CIA,21 Adooleessa 2023,https://www.bbc.com//afaanoromoo/articles/cjeznzny1ngo
Virjil Vaan Daayik Liiverpuul 'yaaddoo' qabaachuu hime,9 Hagayya 2023,https://www.bbc.com//afaanoromoo/articles/cjrlkg9wv7wo
"Neeymaar PSG gadhiisuuf gaafachuu, oduu jijjiirraa Haarii Keeniifi kaan",8 Hagayya 2023,https://www.bbc.com//afaanoromoo/articles/cg6edq0206lo
"Jifataan haaraa Yunaayitid Hoyilaand, Halaand morkachuu danda'aa?",7 Hagayya 2023,https://www.bbc.com//afaanoromoo/articles/c515zgxlz6ko
Liigiin Sa'udii taphattootarratti 'maallaqa guddaa baasuurraa hin deebi'u',4 Hagayya 2023,https://www.bbc.com//afaanoromoo/articles/c97v4g37dzyo
Bara dorgommii baranaa Halaand rikardii kam fa'a cabsuu danda'a?,3 Hagayya 2023,https://www.bbc.com//afaanoromoo/articles/c9ek5xl47eno
Shamarree kaansariirraa bayyanachuun taphattuu urjii waancaa kubbaa miilaa addunyaa taate,3 Hagayya 2023,https://www.bbc.com//afaanoromoo/articles/c2x54x8mk14o
Maaneen Baayern Muniik gadhiisee Al-Naasiritti Ronaaldootti makame,2 Hagayya 2023,https://www.bbc.com//afaanoromoo/articles/cnlyzk0np09o
"Gara Saawdii godaanuu taphattoota Awurooppaa duuba kan jiru, PIF maali?",2 Hagayya 2023,https://www.bbc.com//afaanoromoo/articles/cyx97kg6y06o
Karri eegaa haaraa Yunaayitid dirree keessa Maaguweeritti cooke,31 Adooleessa 2023,https://www.bbc.com//afaanoromoo/articles/cjezz0nd4gdo
Naa'oomii Girmaa: Taphattuu kubbaa miilaa garee biyyaalessaa US'n walbaraa,28 Adooleessa 2023,https://www.bbc.com//afaanoromoo/articles/c25gxw4z79go
Haleellaa hidhattoonni Faannoo N. Oromiyaa Mandiidaatti raawwataniin lubbuun darbe - Qondaala,8 Hagayya 2023,https://www.bbc.com//afaanoromoo/articles/cx90dgwn908o
UN raabsa midhaan gargaarsaa Itoophiyaatti adda kutee ture yaaliif deebi'ee eegale,9 Hagayya 2023,https://www.bbc.com//afaanoromoo/articles/cxwg79ynrz9o
'Maseena qircaa qallee warqee keessaa arganne' - Jiraataa Magaalaa Fiichee,8 Hagayya 2023,https://www.bbc.com//afaanoromoo/articles/cg6ew9qy2eeo
"Hariiroo Itoophiyaa, Ertiraafi Raashiyaa waraanni, qamadiifi niikuleerri jabeesse",7 Hagayya 2023,https://www.bbc.com//afaanoromoo/articles/cj7j8de4ez7o
Gondaritti barsiisaan qormaata seensa yunivarsitii raawwachiisuuf deeme akkamiin ajjeefame?,5 Hagayya 2023,https://www.bbc.com//afaanoromoo/articles/c98pdqr325no
Waa'ee rakkoo naannoo Amaaraatti mudate hanga ammaa maal beekna?,4 Hagayya 2023,https://www.bbc.com//afaanoromoo/articles/c06erp3171eo
'Hamma lubbuunkoo jirutti haqa mucaakootiif iyyuu ittuman fufa',4 Hagayya 2023,https://www.bbc.com//afaanoromoo/articles/ckrjezlykz4o
"Waliin dhahuu baankii onlaayinii Itoophiyaatti hammaate, akkamiinan of eega?",2 Hagayya 2023,https://www.bbc.com//afaanoromoo/articles/c84q1xq4dqxo
Qul. Sinodoosii Ortodoksii Tewaahidoo abbootii amantaa N. Tigiraayirraa aangoo lubummaa mulqe,2 Hagayya 2023,https://www.bbc.com//afaanoromoo/articles/ceky4e73vy2o
"Gaazexeessituu balaa konkolaataan luka dhabde, badhaasa addunyaaf dorgomaa jirtu",9 Hagayya 2023,https://www.bbc.com//afaanoromoo/articles/cp60xk1lznzo
Abbaan warraa haadha manaasaa waggaa 12'f manatti hidhee kaa'e to'atame,8 Hagayya 2023,https://www.bbc.com//afaanoromoo/articles/cjkvgdj2r6ko
Dubartoota addunyaa irratti 'hunda caalaa miidhagan' jedhaman 10,6 Hagayya 2023,https://www.bbc.com//afaanoromoo/articles/cd1zvxe2gvvo
Maaliif sa'aatii wal-fakkaataatti rafuufi ka'uu akka qabdan beektuu?,3 Hagayya 2023,https://www.bbc.com//afaanoromoo/articles/cxepdv7zkpyo
Dhiibbaa rakkoon nageenyaa sochii turizimii Oromiyaarratti uume,3 Hagayya 2023,https://www.bbc.com//afaanoromoo/articles/c04xjlp9083o
Dubartoonni kosii qulquullessan lotorii doolaara mil1.2 injifatan,1 Hagayya 2023,https://www.bbc.com//afaanoromoo/articles/c4nrrgn05zpo
"Haramaayaa deebi'e giddugala turizimii, daldalaafi bashannanaa ta'aa jiru",2 Hagayya 2023,https://www.bbc.com//afaanoromoo/articles/crgnnxk80jzo
Harmi bitaa fi mirgaa kan walcaalu yoo maal ta'edha? Sababi maali?,31 Adooleessa 2023,https://www.bbc.com//afaanoromoo/articles/cx0wy871vvlo
"Dubartiin maatii dhoksitee kittaante, hawwan dhala ofii mukatti hidhanii kittaansisan adabaman",28 Adooleessa 2023,https://www.bbc.com//afaanoromoo/articles/c99xvedgvv2o
Barnoonni Ijiptoolojii maali? Ummatoota Kuush Itoophiyaa keessa jiran barsiisuun ni fayyadaa?,17 Adooleessa 2023,https://www.bbc.com//afaanoromoo/articles/cq5g55wkdrdo
Namoota 'jinnii nama keessaa baasna' jechuun haleellaa saalaa dubartootarratti raawwatan,9 Hagayya 2023,https://www.bbc.com//afaanoromoo/articles/c87mnllj48vo
Fincaan dhuguun fayyaaf bu'aa yookaan miidhaa qabaa?,8 Hagayya 2023,https://www.bbc.com//afaanoromoo/articles/c4n3kvw07x4o
Daa'imni 'Raajii' jedhamteefi kirikira lafaa Siiriyaarra hafte akkam taate?,6 Hagayya 2023,https://www.bbc.com//afaanoromoo/articles/cx8yrvxyy85o
Ugaandaatti lakkoofsi dhiirota abbaa ijoollee isa dhugaa ta'uu baruuf qorannoon godhan dabale,5 Hagayya 2023,https://www.bbc.com//afaanoromoo/articles/ckdnpekw7k5o
Daawwadhaa: Dargaggoo funyoo lafarraa 185m fagaatee hidhameerra deeme,3 Hagayya 2023,https://www.bbc.com//afaanoromoo/articles/c25gwzw150lo
Eertiraa fi Tigiraay keessatti kirkirri lafaa cimaan galmaa'e,2 Hagayya 2023,https://www.bbc.com//afaanoromoo/articles/ckrjlpvpr4yo
Namni kobbee har'a itti fayyadamnu kalaqe eenyu?,30 Adooleessa 2023,https://www.bbc.com//afaanoromoo/articles/c13r7m0npn2o
Barattoota yunivarsitii baala hancabbiirraa shayii tolchan,30 Adooleessa 2023,https://www.bbc.com//afaanoromoo/articles/cx90p04qjvro
Sochii salphaa garuu dhiibbaa dhiigaa hir'isuuf qixxee hin qabne lamaan kana beektuu?,29 Adooleessa 2023,https://www.bbc.com//afaanoromoo/articles/cm5jdgyxg09o
Waa'ee qoricha Vayaagiraa akka tasaa argamuun addunyaa jijjiire beektuu?,26 Adooleessa 2023,https://www.bbc.com//afaanoromoo/articles/c29rz5yg024o
Paayilatii Somaaliyaa biyyasaa boombiin akka haleelu ajajame,9 Hagayya 2023,https://www.bbc.com//afaanoromoo/articles/cl5e2kplegno
Yakkamaan waggootaaf dhokate suuraa gammachuu kubbaa miilaaf ka'en qabame,6 Hagayya 2023,https://www.bbc.com//afaanoromoo/articles/c25g20743qpo
Jaalalleewwan galma lolaan guutame keessa cidha godhatan,6 Hagayya 2023,https://www.bbc.com//afaanoromoo/articles/c19ly32x8mlo
Jaartiin ganna 87 hattuu manashee seene ofirraa lolteefi soorte ijoo dubbii taate,5 Hagayya 2023,https://www.bbc.com//afaanoromoo/articles/c3g1277m414o
Shamarreen Somaaliyaa fiigicha 'akka qocaatti' tirataa xumurte ijoo dubbii taate,3 Hagayya 2023,https://www.bbc.com//afaanoromoo/articles/cd1ev2v9kxyo
'Dubartii ta'uu kiyya dhoksee waggoota jahaaf albuuda qote',31 Adooleessa 2023,https://www.bbc.com//afaanoromoo/articles/c9r11152vp6o
Wantoota ajaa'iboo qaama keenya keessaa kana beektuu?,30 Adooleessa 2023,https://www.bbc.com//afaanoromoo/articles/cw4vjllnmx2o
Meeshaan waliin isaa wallaalame 'samiirraa bu'uu hin oolle' jedhame,1 Hagayya 2023,https://www.bbc.com//afaanoromoo/articles/clk33jlm070o
Eegduun dahoo bineensotaa dorgommii idil-addunyaa mo'atte maal himti?,29 Adooleessa 2023,https://www.bbc.com//afaanoromoo/articles/c4nr9d07ed1o
''Abbaa Atoomik boombii'' kan jedhamu Roobart Oppanhayimar eenyu?,29 Adooleessa 2023,https://www.bbc.com//afaanoromoo/articles/cmlxk99w32jo
Sababoota shan addunyaan waa'ee fonqolcha Niijeer akka yaaddoftu taasisan,9 Hagayya 2023,https://www.bbc.com//afaanoromoo/articles/ck5l6xdd14do
Qabxiilee torba dhimma harma hosiisuu irratti beekuu qabnu,7 Hagayya 2023,https://www.bbc.com//afaanoromoo/articles/c3gz3jlwwj0o
'Kaannisni sababa jijjiirama qilleensaan dursanii dammaquun walhormaata biqiltootaa miidha',5 Hagayya 2023,https://www.bbc.com//afaanoromoo/articles/cn3j0p2xng0o
"Araada geemii ijoollee maatiifi hawaasarraa adda baasaa, rakkoo fayyaa yaadddessaa ta'aa jiru",5 Hagayya 2023,https://www.bbc.com//afaanoromoo/articles/c1wvnjqnz4no
Sababoonni bu'uuraa rakkoo Bataskaana Ortodoksii duuba jiran maali?,31 Adooleessa 2023,https://www.bbc.com//afaanoromoo/articles/cl4mm7p563lo
Dhibeen asmii ganna keessa maaliif namatti hammaata?,27 Adooleessa 2023,https://www.bbc.com//afaanoromoo/articles/c0k45wy8xxgo
Gabaa fi dhiyeessiin bunaa Itoophiyaa maaliif hir'ate?,25 Adooleessa 2023,https://www.bbc.com//afaanoromoo/articles/cql47e7j42wo
Lammii Itoophiyaa qorattoota gara hawaa imalan wal'aanuuf barachaa jiruun walbaraa,24 Adooleessa 2023,https://www.bbc.com//afaanoromoo/articles/cged50we5xyo
Barruu karaa salphaan Hubannoo Namtolchee (AI) hubachuuf gargaaru,21 Adooleessa 2023,https://www.bbc.com//afaanoromoo/resources/idt-74697280-e684-43c5-a782-29e9d11fecf3
Waa'ee Waraqaa Eenyummaa Biyyaalessaa Itoophiyaan yeroo jalqabaaf qopheessite baruu qabdan,21 Adooleessa 2023,https://www.bbc.com//afaanoromoo/articles/cql403gpw11o
